title,text,commentary,locality,category,label
Obama sa ospravedlňuje za pokusy so syfilisom,"Posledné prekvapivé odhalenia nám ukázali, že v štyridsiatych rokoch minulého storočia nezaostávali americké lekárske výskumné tímy za nacistickými výskumníkmi typu Mengele a v „záujme vedy“ tiež uskutočňovali svoje pokusy na nič netušiacich obetiach. Rozdiel bol len v tom, že Američanom sa to podarilo dlhšie utajiť !Ospravedlnenie prišlo so 60 ročným oneskorením: US-vedci infikovali syfilisom v Guatemale 1500 ľudí bez ich vedomia – aby skúmali účinnosť penicilínu. Teraz vyslovil US prezident svoju „najhlbšiu ľútosť“ kvôli, v štyridsiatych rokoch vykonaným pokusom.Washington – USA sa ospravedlnili stovkám ľudí v Guatemale, ktorých pred viacej ako 60 rokmi infikovali pohlavnými chorobami za výskumnými účelmi. V spoločnom vyhlásení označili ministerka zahraničia USA Hillary Clintonová a ministerka zdravotníctva USA, Kathleen Sebeliusová v piatok túto štúdiu ako „neetickú“. Prezident Barack Obama sa v telefonáte s guatemalským prezidentom Alvaro Colom taktiež ospravedlnil za tieto pokusy.Podľa údajov Bieleho domu vyjadril Obama v telefonáte s Colom svoju „najhlbšiu ľútosť“ a ospravedlnil sa u obetí, oznámil hovorca Bieleho domu, Robert Gibbs. Guatemalský prezident hovoril o „zločine proti ľudskosti“. Coloma bol vo štvrtok informovaný Clintonovou o tomto dianí.Ministerka zahraničia USA vyjadrila v telefonáte s Colom svoje „osobné zhrozenie a hlbokú ľútosť“ nad tým, „že sa mohol robiť takýto nemorálny výskum“. Clintonová a ministerka zdravotníctva Sebeliusová požiadali vo svojom spoločnom vyhlásení obete o ospravedlnenie a oznámili rozsiahle vyšetrovanie záležitosti.Lekár John Cutler vyšetril v štyridsiatych rokoch v Guatemale okolo 1500 ľudí, či sa dajú vtedy novou účinnou látkou penicilínom liečiť pohlavné choroby. Pre túto štúdiu zvolil Cutler a jeho tím obzvlášť ohrozených ľudí, medzi nimi i psychicky chorých. Vedci vtedy mali síce povolenie od úradov, ale nie od postihnutých. Tak isto neinformovali zúčastnených o svojom postupe a možných následkoch.Najprv infikovali americkí lekári prostitútky pohlavnou nemocou  tripper alebo syfilisom, potom podnecovali tieto ženy k nechránenému sexu s vojakmi, väzňami a psychicky chorými. Pretože sa takto infikovalo málo mužov, infikovali nakoniec lekári vojakov, väzňov, ako aj psychicky chorých chorobami priamo. Najmenej jeden pacient počas štúdie zomrel, je však nejasné, či bola smrť vyvolaná experimentom.Táto štúdia bola uskutočnená Panamerickým zdravotným úradom, ktorý bol neskôr premenovaný na Panamerickú zdravotnú organizáciu. Výskum bol financovaný Národným zdravotným inštitútom (NIH). Jeho dnešný vedúci Francis Collins označil to čo sa udialo za „neskutočne otrasné“ a za „otrasný príklad pre čiernu kapitolu histórie medicíny“. Senátor  Robert Menendez z hispánskeho výboru kongresu hovoril o  jednom z „najčiernejších momentov“ v histórii USA. „So žiadnym nevinným blížnym, jedno akého pôvodu, by sa nemalo zaobchádzať ako s laboratórnym potkanom.“Tieto pokusy na ľuďoch vyšli najavo až v tomto roku, keď univerzitná profesorka Susan Reverby náhodou našla v jednom archíve o tom dokumenty. Táto štúdia nebola nikdy zverejnená. Zodpovedný lekár Cutler sa zúčastnil aj kontroverznej Tuskegee-Syfilis-štúdie na stovkách Afroameričanov. Pre túto štúdiu neboli medzi 1932 a 1972 čierni občania USA s ochorením na syfilis medicínsky ošetrení.US-úrady nasadili dve vyšetrovacie skupiny, aby sa vtedajšie postupy vyjasnili a aby sa zabezpečilo, aby sa niečo podobného podľa dnešných predpisov už viacej nemohlo vyskytnúť.cai/AFP/apnObama entschuldigt sich für Syphilis-Versuchehttp://www.spiegel.de/politik/ausland/0,1518,720842,00.html",None,None,None,0
Multikulturalizmus prospieva len jedinému etniku,"„Štátny systém, existujúci v našej krajine (t.j. ZSSR v roku 1973), je hrozný nie preto, že je nedemokratický, totalitný, založený na fyzickom obmedzovaní; človek nemôže žiť v takých podmienkach bez toho, aby to uškodilo jeho duchovnej esencii.  Náš súčasný politický systém je unikátny v dejinách preto, lebo okrem fyzických a ekonomických obmedzovaní od nás vyžaduje, aby sme mu dali aj svoje duše; aby sme sa nepretržite a aktívne účastnili na tej všeobecnej, vedomej ‚lži‘.  Tí, čo chcú zostať ľudskými bytosťami, sa nemôžu poddať takejto hnilobe duše, takémuto duchovnému otroctvu.  Keď cisár po tom, čo si už vzal svoje, požaduje ešte nástočivejšie, aby sme mu dali aj to, čo patrí Bohu – to je obeta, akú by sme nikdy nemali urobiť.“Alexander Solženicyn, 1973Kalifornský profesor Kevin MacDonald v rozhovore pre Occidental Observer (link v pôvodnom článku) hovorí, že Židia zohrávajú hlavnú rolu v presadzovaní multikulturalizmu v Európe a spomína, že Barbara Lerner Spectre, ktorá stojí na čele vládou financovanej židovskej študijnej skupiny vo Švédsku, nedávno vyhlásila čosiveľmi pozoruhodné.  Pozoruhodné preto, že ona nepripisuje protižidovské postoje iracionálnym predsudkom, ani moslimom, nenávidiacim Izrael, ale hovorí, že príčinou je „vedúca rola“, ktorú Židia zohrávajú v hnutí za multikulturalizmus.„Nazdávam sa, že oživenie antisemitizmu sa dostavilo preto, lebo Európa sa zatiaľ nenaučila byť multikulturálnou.  A myslím, že my sa ocitneme vo víre tej premeny, ktorá sa musí udiať.  Európa nebude pozostávať z monolitických spoločností, akými kedysi, v poslednom storočí, boli.  A Židia budú v centre toho.  To je veľká premena, ktorou Európa musí prejsť.  Európa nastupuje do multikulturálneho režimu a za to budú odsudzovať Židov, keďže v tom zohrávame hlavnú rolu.  Ale bez tej vedúcej roly a bez tej premeny, Európa neprežije.“Prof. dr. Kevin MacDonald hovorí, že jej komentár je príkladom starovekého židovského seba-konceptu o „svetle národov“: Židia chcú zachrániť Európu tým, že ju povedú k multikulturalizmu.Človek sa čuduje, prečo si pani Lerner Spectre myslí, že Európa nemôže prežiť, keď sa bude skladať z monokultúrnych spoločností.  Izrael a mnohé iné spoločnosti fungujú celkom dobre s jednou dominantnou kultúrou a jedným druhom obyvateľstva a multikulturálne spoločnosti sú naopak veľmi nákladné a nevykazujú žiadne viditeľné pozitíva.  Ale lepšou otázkou samozrejme je, ako môže Európa prežiť multikulturalizmus.  Je jasné (ponímané teoreticky, aj prakticky), že v tom prípade absolútne nemá šancu.“Multikulturalizmus je výhodný len pre jediné svetové etnikum: židovské.Pre všetky ostatné – a pre každú homogénnu spoločnosť – značí jedine rozvrat, zánik a smrť.Zo spoločnosti, rozvrátenej neprirodzeným multikulturalizmom, nemôže vzniknúť nič pozitívne.  Taká spoločnosť môže ako-tak dočasne fungovať len ako tvrdý totalitný režim, ktorý bude mať zákonite za následok milióny životov tých najušľachtilejších ľudí.  Ako píše anglický profesor Frank Ellis:„Ani jedna zo spoločností nevykazuje spontánny sklon smerom k tomu, aby bola multikulturálna a multirasová.  Úspešné a pretrvávajúce spoločnosti vykazujú veľkú mieru homogénnosti.  Tí, čo podporujú multikulturalizmus, toto buď nevedia alebo – čo je pravdepodobnejšie – si uvedomujú, že ak majú premeniť západné spoločnosti na striktne regulované, rasovo-feministické byrokracie, najprv ich musia podkopať.  Táto premena je taká radikálna a revolučná ako nastolenie komunizmu s Sovietskom zväze.Tak, ako vtedy museli všetky aspekty života podrobiť politickej kontrole, aby komisári mohli ľuďom vnútiť svoju víziu spoločnosti, aj multikulturalisti sa nádejajú, že budú kontrolovať a dominovať všetkým stránkam nášho života.  Na rozdiel tvrdej tyranie sovietov, ich tyrania je mäkšia, jemnejšia, ale títo dúfajú, že nás zviažu dohromady tak mocne ako väzňov v gulagu.  Súčasná ‚politická správnosť'(sovietska ‚političeskaja praviľnosť‘ v 20-tych rokoch), to je priamy potomok komunistického teroru a vymývania mozgov.Na rozdiel od vnucovania očividne cudzorodého komunizmu, multikulturalizmus je mimoriadne zákerný preto, lebo si podrobuje morálnu a intelektuálnu infraštruktúru Západu, proti čomu je veľmi ťažké bojovať.Politická správnosť bola (v Sovietskom zväze) predĺženým ramenom politickej kontroly nad vzdelávaním, psychiatriou, etikou a správaním.  Bol to podstatný komponent úsilia zabezpečiť, aby všetky aspekty života zodpovedali ideologickej ortodoxii – čo je typická črta všetkých totalít.  V post-stalinskom období politická správnosť dokonca značila, že v odpore videli mentálnu chorobu, ktorú bolo možné liečiť jedine uväznením.Ako povedal „veľký vodca“ Mao Ce-tung, ‚ak človek nemá správnu politickú orientáciu, to je akoby nemal dušu‘.  Maova Malá červená knižka je plná napomenutí držať sa správnej cesty komunistického myslenia a ku koncu 60-tych rokov bola už maoistická politická správnosť veľmi dobre establišovaná na amerických univerzitách.  A konečné štádium vývoja, ktorého sme svedkami dnes, to je výsledok vzájomného oplodňovania všetkých ‚izmov‘ (anti-rasizmus, feminizmus, štrukturalizmus a post-modernizmus),ktoré dnes dominujú univerzitným učebným osnovám.  Výsledkom toho je nová a virulentná forma totalitarianizmu, ktorej paralely ku komunistickej ére sú očividné.  Súčasné dogmy viedli k neohybným požiadavkám na jazyk, myslenie a správanie a s tými, čo porušujú jej pravidlá, sa zaobchádza, akoby boli mentálne nevyrovnaní – presne ako so sovietskymi disidentmi.Totalita predstavovala oveľa viac, než len štátny teror, cenzúru a koncentračné tábory; to bolo štádium mysle, kde zničili už samotnú ideu súkromného názoru alebo hľadiska.  Totalitný propagandista núti ľudí veriť, že otroctvo je sloboda, nečistota odmena, nevedomosť poznanie a že neohybne spútaná spoločnosť je tou najotvorenejšou spoločnosťou na svete.  Akonáhle donútia dostatok ľudí takto zmýšľať, funkčne ide o totalitu, i keď nejaký diktátor osobne nekontroluje všetky veci.  Pád Ruska do zla a šialenstva, to je mocné varovanie, čo sa môže stať, keď krajina výhlási vojnu minulosti v nádeji, že vybuduje raj na zemi.Multikulturálna spoločnosť zákonite vedie ku konfliktu, nie k súladu.Práve preto sme svedkami rozrastania sa byrokracie, ktorej úlohou je riešiť nedorozumenia medzi rasami a rôznymi kultúrami.  Tie nedorozumenia však nikdy nemožno vyriešiť natrvalo a to preto, lebo byrokrati popierajú základnú príčinu: rasu.  Preto sa toľko hovorí o ‚multikultúrnom‘ a nie ‚multirasovom‘ aspekte.  Dostavuje sa stále viac legislácií, aby hostiteľskú spoločnosť donútili zmieriť sa s čoraz väčšími ústupkami voči menšinám.  Ale to má za následok ešte viac požiadaviek a povzbudzuje to k vojne bez výstrelov voči bielym, ich civilizácii a dokonca aj voči samotnej idey Západu.Multikulturalizmus má rovnakú ambíciu ako sovietsky komunizmus.  Je absolutistický v úsilí o presadenie rôznych agend a pritom vo svojich útokoch na nepriateľov relativizuje všetky ostatné perspektívy.  Multikulturalizmus je ideológiou, ktorá by mala skoncovať so všetkými ideológiami a tieto totalitné ašpirácie nás môžu viesť k dvom záverom:1.  multikulturalizmus musí všade eliminovať akúkoľvek opozíciu; nikde sa nesmie uchovať bezpečný prístav pre kontra-revolucionárov;2.  akonáhle sa ustanoví, multikulturálny raj sa musí ubrániť za každú cenu; všeobecne prijímanú vieru treba udržiavať pomocou všetkých zdrojov štátu.Taká spoločnosť môže viesť len k totalite.  Možno nebude mať koncetračné tábory, ale centrá na pre-vzdelanie a na špeciálny výcvik pre tie úbohé stvorenia, ktoré budú stále zastávať názor ‚bieleho hegemóna‘.  To bude mäkkšia verzia sovietskeho režimu,kde však mysle budú rovnako patriť štátu.  Oslobodia nás od jarma myslenia, preto nebudeme môcť upadnúť do kacírstva politickej nesprávnosti.   Ak sa na multikulturalizmus dívame ako na ďalšiu manifestáciu totality 20. storočia, môžeme sa utešovať faktom, že Sovietsky zväz sa eventuálne zrútil?  Je multikulturalizmus len fázou, periodickou krízou, ktorou Západ prechádza alebo reprezentuje čosi fundamentálne a možno nezvratné?Zatiaľ som načrtol, že keď chceme porozumieť kontextu politickej správnosti a multikulturalizmu, treba sa obrátiť na Sovietsky zväz a jeho katatrofálny utopistický experiment.  Ale PC/multikulturálna mentalita je oveľa staršia.  Edmund Burke v knihe ‚Zamyslenie sa nad revolúciou vo Francúzsku‘ ponúka portrét francúzskych radikálov, ktorý platí aj po dvesto rokoch, odkedy ho napísal:  ‚Nemajú žiadny rešpekt pre múdrosť iných, ale to si kompenzujú vlastnou absolútnou sebaistotou.  Pre nich je dostatočným motívom zničiť starú schému vecí len preto, lebo je stará.  Pokiaľ ide o novú, nemajú obavy o osud narýchlo postavenej budovy, pretože pretrvanie nie je dôležité pre tých, čo si nevážia nič z toho, čo sa urobilo pred nimi a ktorí všetky svoje nádeje vkladajú do objavovania.‘Samozrejme, multikulturalizmus nie je riešením rasového alebo kultúrneho konfliktu.  Naopak.  Multikulturalizmus je cesta k veľmi zvláštnemu druhu pekla, ktoré sme už videli v temnom 20. storočí – pekla, ktoré si sám pre seba a pre druhých buduje človek po tom, čo sa vzdal zdravého rozumu a revoltuje proti božiemu poriadku.výber krátených ukážok z článkov: mi-evprof. dr. Frank Ellis: „Multiculturalism and Marxism“http://reversespins.com/pcmarx.htmlProf. dr. Kevin MacDonald, Current Events: „Jews play a `leading role` in promoting multiculturalism in Europe“Barbara Lerner Spectre: Jews play a ""leading role"" in promoting multiculturalism in EuropeViď aj: Solzhenitsyn: „Chapter 16 „During the Civil War“Odpůrci proti NATO na Slovensku",None,None,None,0
Príhovor admina,"Je to už dlhá doba, čo prestalo vychádzať internetové spravodajstvo prop.sk. Spravodajstvo niektorými považované za kontroverzné, inými dokonca za trestné. Na opačnej strane zasa stáli ľudia považujúci všetko na ::prop-e za sväté a nespochybniteľné. Ako vždy, pravda bola niekde uprostred. Čo sa ale ::prop-u nedalo nikdy vyčítať, bola snaha o vyváženie vyjadrení tzv. „oficiálnych“ spravodajských médií. Snaha o iný uhol pohľadu než ten, ktorý nám bol masmédiami podsúvaný ako jediný správny. A v tomto urobil na Slovensku ::prop obrovský kus práce. Bol to závan čerstvého vzduchu v zatuchnutom prostredí mediálnej manipulácie. Miesto, kde človek mohol prezentovať svoje názory a pohľady. Kde mohol diskutovať vášnivo alebo vecne, kde mohol svoje názory smelo konfrontovať bez obáv, že budú odstránené cenzúrou.Po ukončení činnosti ::prop-u – vďaka trestnému oznámeniu vtedajšej poslankyne za SaS Natálie Blahovej v máji 2010 – som čakal, kto a ako bude pokračovať v najlepších tradíciách ::prop-u. Systém ale očividne zapracoval dostatočne hrozivo na to, aby odradil ľudí od takýchto aktivít. Je zaujímavé, že jednu z hlavných úloh pri ukončení činnosti ::prop-u hrala práve poslankyňa za liberálnu (teda „slobodomyseľnú“) stranu. Je zrejmé, že „sloboda myslenia“ v dnešnom ponímaní liberálov platí iba pre určitú skupinu ľudí a len pre určité názory. Z odporcov totality sa stali totalitári pripúšťajúci iba svoju pravdu.Toto nie je akceptovateľný stav pre slobodných ľudí. Sloboda názorov musí byť dostupná pre všetkých. Každý musí mať právo vyjadriť svoj názor – dokonca aj tí, ktorí majú na svedomí súčasný stav. Čím by sme sa totiž potom od nich líšili? Je tu ale malý rozdiel. Títo ľudia majú pod svojimi palcami médiá a svoje názory šíria masovo. Preto sa to pokúsim vyvážiť túto nerovnováhu aj týmto projektom. Projektom obnovy ::prop-u.Je to cesta ťažká a tŕnistá. Začínam v podstate od nuly. Napriek tomu sa snažím udržať pôvodnú štruktúru ::prop-u, vrátane poniektorých článkov najmä z konca činnosti starého ::prop-u. Chcem totiž začať tam, kde pôvodný ::prop skončil. Pokiaľ sa niekto ako autor cíti poškodený zverejnením starších článkov, môže sa ozvať na prop (zavinac) protiprudu.org, určite sa dohodneme. Pokiaľ máte záujem spolupracovať či už ako prekladatelia alebo autori, budete vítaní. Prípadné nedostatky, chyby či pripomienky môžete zasielať na adresu: prop (zavinac) protiprudu.orgĎakujem.",None,None,None,0
